{
  "schema_version": "alice.recommendation_candidates.v1",
  "recommendation_candidates_id": "d38e42c3-463b-52b8-a50b-df8523a92c7a",
  "request_id": "33333333-3333-4333-8333-333333333333",
  "subject_resolution_id": "a0c3301d-1222-5d40-a7bb-c720912b78c5",
  "generated_at": "2026-04-17T02:15:00Z",
  "request_mode": "open_discovery",
  "thesis_summary": "Thin-universe West Texas screen for solar or hold under $260k.",
  "search_scope": {
    "target_geographies": [
      {
        "kind": "region",
        "label": "West Texas",
        "state_code": "TX"
      }
    ],
    "filters": {
      "max_price": 260000,
      "prefer_transmission_proximity": true
    },
    "budget_max_purchase_price": 260000,
    "active_use_case_hypotheses": [
      "energy",
      "recreational_rural_hold"
    ],
    "notes": []
  },
  "acquisition_summary": {
    "observed_platforms": [
      "landwatch"
    ],
    "input_subject_count": 0,
    "duplicate_input_count": 0,
    "matched_existing_research_count": 1,
    "unmatched_input_count": 0,
    "candidate_observation_limitations": [
      "Open discovery currently depends on the listing candidates Alice has already observed and processed.",
      "Recommendation v0 ranks candidates only from user-supplied URLs or Alice's observed listing catalog.",
      "This candidate universe is not a live or exhaustive market crawl."
    ],
    "acquisition_notes": [
      "Alice keeps hard-filtered and thin-evidence candidates visible instead of silently dropping them.",
      "Candidate acquisition preserves the observed universe before shortlist pruning."
    ]
  },
  "candidate_count": 1,
  "candidates": [
    {
      "candidate_subject_id": "candidate-715ec41d",
      "source_listing_url": "https://www.landwatch.com/texas-land-for-sale/hudspeth-county/property/80-acres-near-sierra-blanca/id/12345678",
      "platform": "landwatch",
      "acquisition_path": "open_discovery_catalog",
      "candidate_observation_status": "observed_with_research_artifacts",
      "observed_at": "2026-04-17T01:05:00Z",
      "raw_listing_hints": {
        "title": "LandWatch listing 12345678 near 80 Acres near Sierra Blanca (TX) in Hudspeth County, TX",
        "asking_price": 240000.0,
        "acreage": 80.0,
        "county_name": "Hudspeth County",
        "state_code": "TX",
        "county_fips": "48229",
        "listing_id": "12345678",
        "listing_text_summary": "80-acre West Texas parcel near Sierra Blanca with county-road access, broad desert views, and seller-marketed solar and rural hold potential."
      },
      "normalized_subject_seed": {
        "input_kind": "listing_url",
        "raw_value": "https://www.landwatch.com/texas-land-for-sale/hudspeth-county/property/80-acres-near-sierra-blanca/id/12345678",
        "canonical_url": "https://www.landwatch.com/texas-land-for-sale/hudspeth-county/property/80-acres-near-sierra-blanca/id/12345678",
        "listing_platform": "landwatch",
        "listing_id": "12345678",
        "county_fips": "48229",
        "county_name": "Hudspeth County",
        "state_fips": "48",
        "state_code": "TX",
        "state_name": "Texas"
      },
      "dedupe_group_id": "dedupe-98bc331a",
      "initial_match_rationale": "Observed listing catalog entry falls inside the active discovery geography scope and can be reused for thesis-aware ranking.",
      "initial_eligibility_status": "eligible",
      "linked_workspace_artifacts": {
        "workspace_root": "DoWhiz_service/skills/alice-ai/examples/workspaces/step7_strong_curated_hudspeth",
        "parcel_memo_ref": "DoWhiz_service/skills/alice-ai/examples/workspaces/step7_strong_curated_hudspeth/alice/parcel_memo.json",
        "coverage_assessment_ref": "DoWhiz_service/skills/alice-ai/examples/workspaces/step7_strong_curated_hudspeth/alice/coverage_assessment.json",
        "parcel_candidates_ref": "DoWhiz_service/skills/alice-ai/examples/workspaces/step7_strong_curated_hudspeth/alice/parcel_candidates.json",
        "report_ref": "DoWhiz_service/skills/alice-ai/examples/workspaces/step7_strong_curated_hudspeth/alice/report.md"
      },
      "notes": []
    }
  ]
}