{
  "schema_version": "alice.recommendation_candidates.v1",
  "recommendation_candidates_id": "16765bd0-04c7-515b-ad66-5332fe79c124",
  "request_id": "22222222-2222-4222-8222-222222222222",
  "subject_resolution_id": "91ee0af7-5d37-51d2-ad0c-12c4f0ca2be5",
  "generated_at": "2026-04-17T02:05:00Z",
  "request_mode": "open_discovery",
  "thesis_summary": "Open discovery across the observed candidate universe for rural hold under $300k.",
  "search_scope": {
    "target_geographies": [],
    "filters": {
      "max_price": 300000
    },
    "budget_max_purchase_price": 300000,
    "active_use_case_hypotheses": [
      "recreational_rural_hold"
    ],
    "notes": []
  },
  "acquisition_summary": {
    "observed_platforms": [
      "landwatch",
      "land_com"
    ],
    "input_subject_count": 0,
    "duplicate_input_count": 0,
    "matched_existing_research_count": 3,
    "unmatched_input_count": 0,
    "candidate_observation_limitations": [
      "Open discovery currently depends on the listing candidates Alice has already observed and processed.",
      "Recommendation v0 ranks candidates only from user-supplied URLs or Alice's observed listing catalog.",
      "This candidate universe is not a live or exhaustive market crawl."
    ],
    "acquisition_notes": [
      "Alice keeps hard-filtered and thin-evidence candidates visible instead of silently dropping them.",
      "Candidate acquisition preserves the observed universe before shortlist pruning."
    ]
  },
  "candidate_count": 3,
  "candidates": [
    {
      "candidate_subject_id": "candidate-4c8d3169",
      "source_listing_url": "https://www.land.com/property/25-acres-in-Autauga-County-Alabama/55555555",
      "platform": "land_com",
      "acquisition_path": "open_discovery_catalog",
      "candidate_observation_status": "observed_with_research_artifacts",
      "observed_at": "2026-04-17T01:10:00Z",
      "raw_listing_hints": {
        "title": "Land.com listing 55555555 near 25 Acres in Autauga County Alabama (AL)",
        "asking_price": 185000.0,
        "acreage": 25.0,
        "county_name": "Autauga County",
        "state_code": "AL",
        "county_fips": "01001",
        "listing_id": "55555555",
        "listing_text_summary": "25-acre Alabama listing with rural road access and light development upside, offered as a first-pass rural hold opportunity."
      },
      "normalized_subject_seed": {
        "input_kind": "listing_url",
        "raw_value": "https://www.land.com/property/25-acres-in-Autauga-County-Alabama/55555555",
        "canonical_url": "https://www.land.com/property/25-acres-in-Autauga-County-Alabama/55555555",
        "listing_platform": "land_com",
        "listing_id": "55555555",
        "county_fips": "01001",
        "county_name": "Autauga County",
        "state_fips": "01",
        "state_code": "AL",
        "state_name": "Alabama"
      },
      "dedupe_group_id": "dedupe-757321f9",
      "initial_match_rationale": "Observed listing catalog entry falls inside the active discovery geography scope and can be reused for thesis-aware ranking.",
      "initial_eligibility_status": "eligible",
      "linked_workspace_artifacts": {
        "workspace_root": "DoWhiz_service/skills/alice-ai/examples/workspaces/step7_fallback_weak_autauga",
        "parcel_memo_ref": "DoWhiz_service/skills/alice-ai/examples/workspaces/step7_fallback_weak_autauga/alice/parcel_memo.json",
        "coverage_assessment_ref": "DoWhiz_service/skills/alice-ai/examples/workspaces/step7_fallback_weak_autauga/alice/coverage_assessment.json",
        "parcel_candidates_ref": "DoWhiz_service/skills/alice-ai/examples/workspaces/step7_fallback_weak_autauga/alice/parcel_candidates.json",
        "report_ref": "DoWhiz_service/skills/alice-ai/examples/workspaces/step7_fallback_weak_autauga/alice/report.md"
      },
      "notes": []
    },
    {
      "candidate_subject_id": "candidate-beeb7c86",
      "source_listing_url": "https://www.land.com/property/160-acres-near-Bakersfield-Kern-County-California/60606060",
      "platform": "land_com",
      "acquisition_path": "open_discovery_catalog",
      "candidate_observation_status": "observed_with_research_artifacts",
      "observed_at": "2026-04-17T01:15:00Z",
      "raw_listing_hints": {
        "title": "Land.com listing 60606060 near Bakersfield, Kern County, CA",
        "asking_price": 640000.0,
        "acreage": 160.0,
        "county_name": "Kern County",
        "state_code": "CA",
        "county_fips": "06029",
        "listing_id": "60606060",
        "listing_text_summary": "160-acre Kern County land listing near Bakersfield with seller-stated APN 123-450-17-00-5, rural road frontage, and solar plus storage potential."
      },
      "normalized_subject_seed": {
        "input_kind": "listing_url",
        "raw_value": "https://www.land.com/property/160-acres-near-Bakersfield-Kern-County-California/60606060",
        "canonical_url": "https://www.land.com/property/160-acres-near-Bakersfield-Kern-County-California/60606060",
        "listing_platform": "land_com",
        "listing_id": "60606060",
        "county_fips": "06029",
        "county_name": "Kern County",
        "state_fips": "06",
        "state_code": "CA",
        "state_name": "California"
      },
      "dedupe_group_id": "dedupe-18c23636",
      "initial_match_rationale": "Observed listing catalog entry falls inside the active discovery geography scope and can be reused for thesis-aware ranking.",
      "initial_eligibility_status": "hard_filtered",
      "linked_workspace_artifacts": {
        "workspace_root": "DoWhiz_service/skills/alice-ai/examples/workspaces/step7_competing_kern",
        "parcel_memo_ref": "DoWhiz_service/skills/alice-ai/examples/workspaces/step7_competing_kern/alice/parcel_memo.json",
        "coverage_assessment_ref": "DoWhiz_service/skills/alice-ai/examples/workspaces/step7_competing_kern/alice/coverage_assessment.json",
        "parcel_candidates_ref": "DoWhiz_service/skills/alice-ai/examples/workspaces/step7_competing_kern/alice/parcel_candidates.json",
        "report_ref": "DoWhiz_service/skills/alice-ai/examples/workspaces/step7_competing_kern/alice/report.md"
      },
      "notes": [
        "Current request filters will likely exclude this candidate before ranking."
      ]
    },
    {
      "candidate_subject_id": "candidate-495aa41e",
      "source_listing_url": "https://www.landwatch.com/texas-land-for-sale/hudspeth-county/property/80-acres-near-sierra-blanca/id/12345678",
      "platform": "landwatch",
      "acquisition_path": "open_discovery_catalog",
      "candidate_observation_status": "observed_with_research_artifacts",
      "observed_at": "2026-04-17T01:05:00Z",
      "raw_listing_hints": {
        "title": "LandWatch listing 12345678 near 80 Acres near Sierra Blanca (TX) in Hudspeth County, TX",
        "asking_price": 240000.0,
        "acreage": 80.0,
        "county_name": "Hudspeth County",
        "state_code": "TX",
        "county_fips": "48229",
        "listing_id": "12345678",
        "listing_text_summary": "80-acre West Texas parcel near Sierra Blanca with county-road access, broad desert views, and seller-marketed solar and rural hold potential."
      },
      "normalized_subject_seed": {
        "input_kind": "listing_url",
        "raw_value": "https://www.landwatch.com/texas-land-for-sale/hudspeth-county/property/80-acres-near-sierra-blanca/id/12345678",
        "canonical_url": "https://www.landwatch.com/texas-land-for-sale/hudspeth-county/property/80-acres-near-sierra-blanca/id/12345678",
        "listing_platform": "landwatch",
        "listing_id": "12345678",
        "county_fips": "48229",
        "county_name": "Hudspeth County",
        "state_fips": "48",
        "state_code": "TX",
        "state_name": "Texas"
      },
      "dedupe_group_id": "dedupe-98bc331a",
      "initial_match_rationale": "Observed listing catalog entry falls inside the active discovery geography scope and can be reused for thesis-aware ranking.",
      "initial_eligibility_status": "eligible",
      "linked_workspace_artifacts": {
        "workspace_root": "DoWhiz_service/skills/alice-ai/examples/workspaces/step7_strong_curated_hudspeth",
        "parcel_memo_ref": "DoWhiz_service/skills/alice-ai/examples/workspaces/step7_strong_curated_hudspeth/alice/parcel_memo.json",
        "coverage_assessment_ref": "DoWhiz_service/skills/alice-ai/examples/workspaces/step7_strong_curated_hudspeth/alice/coverage_assessment.json",
        "parcel_candidates_ref": "DoWhiz_service/skills/alice-ai/examples/workspaces/step7_strong_curated_hudspeth/alice/parcel_candidates.json",
        "report_ref": "DoWhiz_service/skills/alice-ai/examples/workspaces/step7_strong_curated_hudspeth/alice/report.md"
      },
      "notes": []
    }
  ]
}